{
 "schema": "pqc/map@1",
 "id": "lantern_road",
 "name": "The Lantern Road",
 "region": "lanternmarch",
 "biome": "meadow",
 "size": [
  40,
  26
 ],
 "base": "grass_base",
 "seed": 37,
 "layers": [
  {
   "terrain": "dirt",
   "rows": [
    "........................................",
    "........................................",
    "........................................",
    "....FFFFFFFFF...........................",
    "....FFFFFFFFF...........................",
    "....FFFFFFFFF...........................",
    "....FFFFFFFFF...........................",
    "....FFFFFFFFF...........................",
    "....FFFFFFFFF...........................",
    "........................................",
    "........................................",
    "........................................",
    "........................................",
    "........................................",
    "........................................",
    "........................................",
    "........................................",
    "........................................",
    "........................................",
    "........................................",
    "........................................",
    "........................................",
    "........................................",
    "........................................",
    "........................................",
    "........................................"
   ]
  },
  {
   "terrain": "dirt",
   "rows": [
    "..................DD....................",
    "..................DD....................",
    "..................DD....................",
    "..................DD....................",
    "..................DD....................",
    "..................DD....................",
    "..................DD....................",
    "..................DD....................",
    "..................DDD...................",
    "...................DD...................",
    "...................DD...................",
    "...................DD...................",
    "...................DD...................",
    "...................DD...................",
    "...................DD...................",
    "...................DD...................",
    "...................DDD..................",
    "....................DD..................",
    "....................DD..................",
    "....................DD..................",
    "....................DD..................",
    "....................DD..................",
    "....................DD..................",
    "....................DD..................",
    "....................DD..................",
    "....................DD.................."
   ]
  },
  {
   "terrain": "dirt_dark",
   "rows": [
    "........................................",
    "........................................",
    "........................................",
    "........................................",
    "........................................",
    "........................................",
    "........................................",
    "........................................",
    "........................................",
    "........................................",
    "........................................",
    "........................................",
    "........................................",
    ".....................TTTTT..............",
    ".....................TTTTTTTT...........",
    ".........................TTTTTTTTT......",
    "............................TTTTTTTTT...",
    ".................................TTTTTTT",
    "....................................TTTT",
    "........................................",
    "........................................",
    "........................................",
    "........................................",
    "........................................",
    "........................................",
    "........................................"
   ]
  }
 ],
 "props": [
  {
   "prop": "stone_lantern",
   "at": [
    22,
    11
   ],
   "id": "lantern_road.037",
   "light": "dead",
   "label": "Lantern 37"
  },
  {
   "prop": "stone_lantern",
   "at": [
    23,
    23
   ],
   "id": "lantern_road.038",
   "light": "lit",
   "label": "Lantern 38"
  },
  {
   "prop": "sign",
   "at": [
    17,
    4
   ],
   "id": "milestone",
   "label": "Brindle Cross 1 mile - Fort Harrow 39 miles"
  },
  {
   "prop": "haystack",
   "at": [
    14,
    4
   ]
  },
  {
   "prop": "haystack",
   "at": [
    15,
    6
   ]
  },
  {
   "prop": "cart",
   "at": [
    13,
    9
   ]
  },
  {
   "prop": "barrel",
   "at": [
    3,
    10
   ]
  },
  {
   "prop": "pine_cluster",
   "at": [
    30,
    0
   ]
  },
  {
   "prop": "pine_cluster",
   "at": [
    34,
    1
   ]
  },
  {
   "prop": "pine_cluster",
   "at": [
    36,
    4
   ]
  },
  {
   "prop": "pine_cluster",
   "at": [
    29,
    4
   ]
  },
  {
   "prop": "pine_cluster",
   "at": [
    33,
    7
   ]
  },
  {
   "prop": "pine_cluster",
   "at": [
    36,
    9
   ]
  },
  {
   "prop": "pine_cluster",
   "at": [
    31,
    19
   ]
  },
  {
   "prop": "pine_cluster",
   "at": [
    35,
    21
   ]
  },
  {
   "prop": "pine_cluster",
   "at": [
    28,
    22
   ]
  },
  {
   "prop": "pine_cluster",
   "at": [
    36,
    13
   ]
  },
  {
   "prop": "tree_pine",
   "at": [
    26,
    2
   ]
  },
  {
   "prop": "tree_pine",
   "at": [
    27,
    8
   ]
  },
  {
   "prop": "tree_pine",
   "at": [
    25,
    17
   ]
  },
  {
   "prop": "tree_pine",
   "at": [
    26,
    20
   ]
  },
  {
   "prop": "tree_pine",
   "at": [
    38,
    11
   ]
  },
  {
   "prop": "tree_pine",
   "at": [
    33,
    11
   ]
  },
  {
   "prop": "tree_pine",
   "at": [
    30,
    10
   ]
  },
  {
   "prop": "tree_pine",
   "at": [
    38,
    22
   ]
  },
  {
   "prop": "tree_pine",
   "at": [
    32,
    24
   ]
  },
  {
   "prop": "tree_dead",
   "at": [
    24,
    6
   ]
  },
  {
   "prop": "tree_dead",
   "at": [
    28,
    18
   ]
  },
  {
   "prop": "tree_dead",
   "at": [
    39,
    7
   ]
  },
  {
   "prop": "tree_dead",
   "at": [
    34,
    19
   ]
  },
  {
   "prop": "tree_light",
   "at": [
    0,
    0
   ]
  },
  {
   "prop": "tree_light",
   "at": [
    2,
    15
   ]
  },
  {
   "prop": "tree_light",
   "at": [
    6,
    19
   ]
  },
  {
   "prop": "tree_light",
   "at": [
    11,
    22
   ]
  },
  {
   "prop": "tree_light",
   "at": [
    1,
    23
   ]
  },
  {
   "prop": "tree_light",
   "at": [
    14,
    17
   ]
  },
  {
   "prop": "tree_round",
   "at": [
    8,
    13
   ]
  },
  {
   "prop": "tree_round",
   "at": [
    3,
    2
   ]
  },
  {
   "prop": "boulders",
   "at": [
    9,
    16
   ]
  },
  {
   "prop": "stump",
   "at": [
    16,
    20
   ]
  },
  {
   "prop": "rock_brown",
   "at": [
    25,
    9
   ]
  },
  {
   "prop": "footprints",
   "at": [
    24,
    13
   ]
  },
  {
   "prop": "footprints",
   "at": [
    28,
    15
   ]
  },
  {
   "prop": "footprints",
   "at": [
    32,
    16
   ]
  },
  {
   "prop": "footprints",
   "at": [
    36,
    17
   ]
  },
  {
   "prop": "twigs",
   "at": [
    27,
    15
   ]
  },
  {
   "prop": "claw_marks",
   "at": [
    21,
    13
   ]
  },
  {
   "prop": "bone",
   "at": [
    34,
    18
   ]
  },
  {
   "prop": "bush",
   "at": [
    5,
    12
   ]
  },
  {
   "prop": "bush2",
   "at": [
    12,
    14
   ]
  },
  {
   "prop": "bush2",
   "at": [
    16,
    12
   ]
  },
  {
   "prop": "bush",
   "at": [
    23,
    4
   ]
  },
  {
   "prop": "bush2",
   "at": [
    11,
    1
   ]
  },
  {
   "prop": "bush2",
   "at": [
    7,
    21
   ]
  },
  {
   "prop": "bush",
   "at": [
    15,
    24
   ]
  },
  {
   "prop": "bush2",
   "at": [
    24,
    22
   ]
  },
  {
   "prop": "flowers2",
   "at": [
    6,
    11
   ]
  },
  {
   "prop": "flowers2",
   "at": [
    10,
    12
   ]
  },
  {
   "prop": "flowers2",
   "at": [
    14,
    13
   ]
  },
  {
   "prop": "flowers2",
   "at": [
    22,
    2
   ]
  },
  {
   "prop": "flowers",
   "at": [
    3,
    17
   ]
  },
  {
   "prop": "flowers2",
   "at": [
    9,
    24
   ]
  },
  {
   "prop": "flowers",
   "at": [
    17,
    15
   ]
  },
  {
   "prop": "rock_small",
   "at": [
    23,
    15
   ]
  },
  {
   "prop": "rock_small",
   "at": [
    17,
    22
   ]
  },
  {
   "prop": "rock_small",
   "at": [
    12,
    18
   ]
  }
 ],
 "points": {
  "north_road": [
   18,
   0
  ],
  "milestone": [
   18,
   5
  ],
  "lantern_37": [
   22,
   14
  ],
  "lantern_37_west": [
   21,
   12
  ],
  "trail_start": [
   24,
   14
  ],
  "woods_edge": [
   30,
   16
  ],
  "east_exit": [
   39,
   18
  ],
  "field": [
   8,
   10
  ],
  "south_road": [
   20,
   25
  ],
  "lantern_38": [
   23,
   25
  ]
 }
}