{
 "schema": "pqc/map@1",
 "id": "crooked_kettle_interior",
 "name": "The Crooked Kettle (inside)",
 "region": "lanternmarch",
 "biome": "interior",
 "size": [
  25,
  15
 ],
 "base": "floor_wood",
 "seed": 7,
 "layers": [],
 "points": {
  "front_door": [
   8,
   13
  ],
  "common_room": [
   8,
   8
  ],
  "hearth": [
   3,
   4
  ],
  "hearth_east": [
   5,
   4
  ],
  "bar": [
   13,
   5
  ],
  "behind_bar": [
   13,
   2
  ],
  "table_west": [
   4,
   8
  ],
  "table_south": [
   4,
   10
  ],
  "table_east": [
   11,
   10
  ],
  "stairs": [
   1,
   2
  ],
  "storeroom_door": [
   17,
   10
  ],
  "storeroom": [
   21,
   8
  ],
  "rusk_corner": [
   20,
   6
  ]
 },
 "props": [
  {"prop": "wall_tl", "at": [0, 0]},
  {"prop": "wall_tr", "at": [17, 0]},
  {"prop": "wall_bl", "at": [0, 14]},
  {"prop": "wall_br", "at": [17, 14]},
  {"prop": "wall_top", "at": [1, 0]},
  {"prop": "wall_bottom", "at": [1, 14]},
  {"prop": "wall_top", "at": [2, 0]},
  {"prop": "wall_bottom", "at": [2, 14]},
  {"prop": "wall_top", "at": [3, 0]},
  {"prop": "wall_bottom", "at": [3, 14]},
  {"prop": "wall_top", "at": [4, 0]},
  {"prop": "wall_bottom", "at": [4, 14]},
  {"prop": "wall_top", "at": [5, 0]},
  {"prop": "wall_bottom", "at": [5, 14]},
  {"prop": "wall_top", "at": [6, 0]},
  {"prop": "wall_bottom", "at": [6, 14]},
  {"prop": "wall_top", "at": [7, 0]},
  {"prop": "wall_bottom_end_r", "at": [7, 14]},
  {"prop": "wall_top", "at": [8, 0]},
  {"prop": "wall_top", "at": [9, 0]},
  {"prop": "wall_bottom_end_l", "at": [9, 14]},
  {"prop": "wall_top", "at": [10, 0]},
  {"prop": "wall_bottom", "at": [10, 14]},
  {"prop": "wall_top", "at": [11, 0]},
  {"prop": "wall_bottom", "at": [11, 14]},
  {"prop": "wall_top", "at": [12, 0]},
  {"prop": "wall_bottom", "at": [12, 14]},
  {"prop": "wall_top", "at": [13, 0]},
  {"prop": "wall_bottom", "at": [13, 14]},
  {"prop": "wall_top", "at": [14, 0]},
  {"prop": "wall_bottom", "at": [14, 14]},
  {"prop": "wall_top", "at": [15, 0]},
  {"prop": "wall_bottom", "at": [15, 14]},
  {"prop": "wall_top", "at": [16, 0]},
  {"prop": "wall_bottom", "at": [16, 14]},
  {"prop": "wall_left", "at": [0, 1]},
  {"prop": "wall_left", "at": [0, 2]},
  {"prop": "wall_left", "at": [0, 3]},
  {"prop": "wall_left", "at": [0, 4]},
  {"prop": "wall_left", "at": [0, 5]},
  {"prop": "wall_left", "at": [0, 6]},
  {"prop": "wall_left", "at": [0, 7]},
  {"prop": "wall_left", "at": [0, 8]},
  {"prop": "wall_left", "at": [0, 9]},
  {"prop": "wall_left", "at": [0, 10]},
  {"prop": "wall_left", "at": [0, 11]},
  {"prop": "wall_left", "at": [0, 12]},
  {"prop": "wall_left", "at": [0, 13]},
  {"prop": "wall_right", "at": [17, 1]},
  {"prop": "wall_right", "at": [17, 2]},
  {"prop": "wall_right", "at": [17, 3]},
  {"prop": "wall_right", "at": [17, 4]},
  {"prop": "wall_right", "at": [17, 5]},
  {"prop": "wall_right", "at": [17, 6]},
  {"prop": "wall_right", "at": [17, 7]},
  {"prop": "wall_right", "at": [17, 8]},
  {"prop": "wall_right_end_b", "at": [17, 9]},
  {"prop": "wall_right_end_t", "at": [17, 11]},
  {"prop": "wall_right", "at": [17, 12]},
  {"prop": "wall_right", "at": [17, 13]},
  {"prop": "wall_tl", "at": [18, 0]},
  {"prop": "wall_tr", "at": [24, 0]},
  {"prop": "wall_bl", "at": [18, 14]},
  {"prop": "wall_br", "at": [24, 14]},
  {"prop": "wall_top", "at": [19, 0]},
  {"prop": "wall_bottom", "at": [19, 14]},
  {"prop": "wall_top", "at": [20, 0]},
  {"prop": "wall_bottom", "at": [20, 14]},
  {"prop": "wall_top", "at": [21, 0]},
  {"prop": "wall_bottom", "at": [21, 14]},
  {"prop": "wall_top", "at": [22, 0]},
  {"prop": "wall_bottom", "at": [22, 14]},
  {"prop": "wall_top", "at": [23, 0]},
  {"prop": "wall_bottom", "at": [23, 14]},
  {"prop": "wall_left", "at": [18, 1]},
  {"prop": "wall_left", "at": [18, 2]},
  {"prop": "wall_left", "at": [18, 3]},
  {"prop": "wall_left", "at": [18, 4]},
  {"prop": "wall_left", "at": [18, 5]},
  {"prop": "wall_left", "at": [18, 6]},
  {"prop": "wall_left", "at": [18, 7]},
  {"prop": "wall_left", "at": [18, 8]},
  {"prop": "wall_left_end_b", "at": [18, 9]},
  {"prop": "wall_left_end_t", "at": [18, 11]},
  {"prop": "wall_left", "at": [18, 12]},
  {"prop": "wall_left", "at": [18, 13]},
  {"prop": "wall_right", "at": [24, 1]},
  {"prop": "wall_right", "at": [24, 2]},
  {"prop": "wall_right", "at": [24, 3]},
  {"prop": "wall_right", "at": [24, 4]},
  {"prop": "wall_right", "at": [24, 5]},
  {"prop": "wall_right", "at": [24, 6]},
  {"prop": "wall_right", "at": [24, 7]},
  {"prop": "wall_right", "at": [24, 8]},
  {"prop": "wall_right", "at": [24, 9]},
  {"prop": "wall_right", "at": [24, 10]},
  {"prop": "wall_right", "at": [24, 11]},
  {"prop": "wall_right", "at": [24, 12]},
  {"prop": "wall_right", "at": [24, 13]},
  {"prop": "stairs_up", "at": [1, 1], "label": "Stairs to the rooms"},
  {"prop": "hearth", "at": [3, 1], "id": "hearth", "label": "The hearth"},
  {"prop": "cauldron", "at": [4, 1]},
  {"prop": "brazier", "at": [2, 1], "id": "hearth_fire"},
  {"prop": "bench_long", "at": [2, 3]},
  {"prop": "bookshelf", "at": [6, 1], "label": "The Lamplighters' ledger shelf"},
  {"prop": "table_long", "at": [11, 4], "label": "The bar"},
  {"prop": "table_long", "at": [14, 4]},
  {"prop": "barrel", "at": [12, 1]},
  {"prop": "barrel", "at": [14, 1]},
  {"prop": "barrel", "at": [16, 1]},
  {"prop": "dresser", "at": [10, 1]},
  {"prop": "stool", "at": [12, 5]},
  {"prop": "stool", "at": [15, 5]},
  {"prop": "candle", "at": [16, 3], "id": "bar_candle"},
  {"prop": "table_long", "at": [3, 7]},
  {"prop": "chair", "at": [2, 7]},
  {"prop": "chair", "at": [6, 7]},
  {"prop": "table_long", "at": [3, 11]},
  {"prop": "chair", "at": [2, 11]},
  {"prop": "chair", "at": [6, 11]},
  {"prop": "table_long", "at": [10, 9]},
  {"prop": "chair", "at": [9, 9]},
  {"prop": "chair", "at": [13, 9]},
  {"prop": "candle", "at": [4, 7], "id": "table_candle"},
  {"prop": "vase", "at": [16, 13]},
  {"prop": "vase", "at": [1, 13]},
  {"prop": "barrel", "at": [19, 1]},
  {"prop": "barrel", "at": [20, 1]},
  {"prop": "barrel", "at": [23, 1]},
  {"prop": "barrel", "at": [23, 2]},
  {"prop": "barrel", "at": [19, 13]},
  {"prop": "barrel", "at": [23, 13]},
  {"prop": "sack", "at": [21, 1]},
  {"prop": "sack", "at": [22, 1]},
  {"prop": "sack", "at": [19, 3]},
  {"prop": "sack", "at": [22, 12]},
  {"prop": "candle", "at": [23, 6], "id": "store_candle"},
  {"prop": "dresser", "at": [22, 9]}
 ]
}